{
  "$schema": "http://json-schema.org/draft-07/schema#",
  "$id": "https://github.com/csantisgallegos/context/tasks/schema.json",
  "title": "ContextTask",
  "description": "Estructura de tarea para agentes IA (Claude Code, GitHub Copilot, Codex). Cada archivo define una unidad de trabajo implementable de forma autónoma.",
  "type": "object",
  "required": [
    "id",
    "title",
    "description",
    "phase",
    "version_target",
    "priority",
    "status",
    "context",
    "steps",
    "acceptance_criteria",
    "outputs"
  ],
  "properties": {
    "$schema": { "type": "string" },
    "id": {
      "type": "string",
      "description": "Identificador único. Formato: p{phase}-t{número} (ej: p1-t01)",
      "pattern": "^p[1-4]-t[0-9]{2}$"
    },
    "title": {
      "type": "string",
      "description": "Título corto de la tarea (máximo 80 caracteres)",
      "maxLength": 80
    },
    "description": {
      "type": "string",
      "description": "Explicación completa de qué hace esta tarea y por qué existe"
    },
    "phase": {
      "type": "integer",
      "description": "Fase del plan de evolución",
      "enum": [1, 2, 3, 4]
    },
    "version_target": {
      "type": "string",
      "description": "Versión del proyecto donde debe quedar lista esta tarea",
      "pattern": "^[0-9]+\\.[0-9]+\\.[0-9]+$"
    },
    "priority": {
      "type": "string",
      "description": "Nivel de prioridad de implementación",
      "enum": ["critical", "high", "medium", "low"]
    },
    "status": {
      "type": "string",
      "description": "Estado actual de la tarea",
      "enum": ["pending", "in-progress", "done", "blocked"]
    },
    "estimated_effort": {
      "type": "string",
      "description": "Esfuerzo estimado de implementación",
      "enum": ["small", "medium", "large"]
    },
    "tags": {
      "type": "array",
      "description": "Etiquetas para clasificar y filtrar tareas",
      "items": { "type": "string" }
    },
    "iso_alignment": {
      "type": "array",
      "description": "Estándares ISO que esta tarea ayuda a cumplir",
      "items": {
        "type": "string",
        "examples": [
          "ISO/IEC 27001:2022",
          "ISO/IEC 27002:2022",
          "ISO/IEC 25010",
          "ISO/IEC/IEEE 12207",
          "ISO/IEC 27701:2025"
        ]
      }
    },
    "dependencies": {
      "type": "array",
      "description": "IDs de tareas que deben completarse antes de iniciar esta",
      "items": {
        "type": "string",
        "pattern": "^p[1-4]-t[0-9]{2}$"
      }
    },
    "context": {
      "type": "object",
      "description": "Contexto necesario para que el agente entienda la tarea",
      "required": ["why", "current_state", "files_to_read"],
      "properties": {
        "why": {
          "type": "string",
          "description": "Motivación: por qué es necesaria esta tarea"
        },
        "current_state": {
          "type": "string",
          "description": "Estado actual del código relevante a esta tarea"
        },
        "files_to_read": {
          "type": "array",
          "description": "Archivos que el agente debe leer antes de implementar",
          "items": { "type": "string" }
        },
        "key_concepts": {
          "type": "array",
          "description": "Conceptos técnicos clave que el agente debe tener en cuenta",
          "items": { "type": "string" }
        },
        "constraints": {
          "type": "array",
          "description": "Restricciones o reglas que el agente no debe violar",
          "items": { "type": "string" }
        }
      }
    },
    "steps": {
      "type": "array",
      "description": "Pasos ordenados de implementación",
      "minItems": 1,
      "items": {
        "type": "object",
        "required": ["order", "action"],
        "properties": {
          "order": { "type": "integer" },
          "action": {
            "type": "string",
            "description": "Descripción clara de la acción a realizar"
          },
          "detail": {
            "type": "string",
            "description": "Detalle adicional, ejemplos de código o notas de implementación"
          },
          "command": {
            "type": "string",
            "description": "Comando CLI a ejecutar (si aplica)"
          },
          "file": {
            "type": "string",
            "description": "Archivo específico a crear o modificar"
          }
        }
      }
    },
    "acceptance_criteria": {
      "type": "array",
      "description": "Condiciones verificables que deben cumplirse para marcar la tarea como done",
      "minItems": 1,
      "items": { "type": "string" }
    },
    "agent_instructions": {
      "type": "object",
      "description": "Instrucciones específicas por tipo de agente IA",
      "properties": {
        "general": {
          "type": "string",
          "description": "Instrucciones generales válidas para cualquier agente"
        },
        "claude_code": {
          "type": "string",
          "description": "Instrucciones optimizadas para Claude Code CLI"
        },
        "copilot": {
          "type": "string",
          "description": "Instrucciones optimizadas para GitHub Copilot"
        },
        "codex": {
          "type": "string",
          "description": "Instrucciones optimizadas para OpenAI Codex / ChatGPT"
        }
      }
    },
    "outputs": {
      "type": "array",
      "description": "Archivos o cambios esperados al completar la tarea",
      "minItems": 1,
      "items": { "type": "string" }
    }
  }
}
