{
  "$schema": "../schema.json",
  "id": "p4-t02",
  "title": "Método toAgentMd(): generar AGENT.md como índice de contexto para cualquier agente de IA",
  "description": "Agregar el método toAgentMd() a ContextEngine que genera un archivo AGENT.md que sirve como punto de entrada para cualquier agente de IA (no acoplado a ningún agente específico). El AGENT.md es un índice que apunta a los archivos en context/ y resume el estado del proyecto. No contiene toda la información — invita al agente a leer context/ para obtener el detalle.",
  "phase": 4,
  "version_target": "0.5.0",
  "priority": "critical",
  "status": "pending",
  "estimated_effort": "medium",
  "tags": ["output", "agent-md", "documentation", "core", "multi-agent"],
  "iso_alignment": [
    "ISO/IEC 25010 - Usability",
    "ISO/IEC/IEEE 12207 - Documentation Process"
  ],
  "dependencies": ["p3-t01", "p3-t02", "p2-t01"],
  "context": {
    "why": "AGENT.md es el archivo que cualquier agente de IA lee al iniciar una sesión en el proyecto. No está acoplado a ningún agente específico: es Markdown estándar que cualquier herramienta puede procesar. Si no existe o está desactualizado, el agente trabaja sin contexto. Este método lo genera automáticamente y lo mantiene actualizado con cada scan.",
    "current_state": "No existe ningún generador de AGENT.md. ContextEngine tiene toMarkdown() pero genera un formato monolítico. La nueva visión requiere un archivo índice ligero que apunte a context/, no que duplique su contenido.",
    "files_to_read": [
      "packages/context-core/src/engine.ts",
      "packages/context-core/src/types.ts"
    ],
    "key_concepts": [
      "AGENT.md es un índice, no un documento: apunta a context/ en vez de duplicar su contenido",
      "Secciones: Header del proyecto, 'Lee esto primero' (links a context/), Tarea activa, Estado técnico resumido, Avisos de compliance",
      "El archivo se sobreescribe en cada context scan (es la única fuente auto-generada en la raíz)",
      "Señales ISO críticas aparecen como avisos breves con link a signals/ para el detalle",
      "No está acoplado a ningún agente de IA específico: es Markdown estándar",
      "Incluir el comando para actualizar: 'context scan --project-root=.'"
    ],
    "constraints": [
      "AGENT.md no debe superar 80 líneas — es un índice, no documentación",
      "No incluir rutas absolutas del sistema, solo rutas relativas al proyecto",
      "No incluir valores de variables de entorno",
      "El archivo debe ser Markdown válido",
      "Siempre se sobreescribe con context scan (a diferencia de architecture.md y conventions.md que el developer edita)"
    ]
  },
  "steps": [
    {
      "order": 1,
      "action": "Definir interface CLAUDEmdOptions",
      "file": "packages/context-core/src/engine.ts",
      "detail": "export interface CLAUDEmdOptions {\n  projectName?: string;         // override del nombre del proyecto\n  language?: 'en' | 'es';      // default: 'en'\n  includeSections?: CLAUDEmdSection[];\n  complianceSummary?: boolean;  // default: true\n}\n\nexport type CLAUDEmdSection =\n  | 'overview'\n  | 'commands'\n  | 'architecture'\n  | 'conventions'\n  | 'compliance'\n  | 'important-notes';"
    },
    {
      "order": 2,
      "action": "Crear claude-md-builder.ts con los builders de cada sección",
      "file": "packages/context-core/src/claude-md-builder.ts",
      "detail": "Funciones puras que construyen cada sección del CLAUDE.md:\n\nbuildOverviewSection(pkgCtx, gitCtx): string\n  Genera:\n  # {projectName}\n  {description}\n  - **Version:** {version}\n  - **Branch:** {currentBranch}\n  - **Stack:** {primaryFramework} + {language}\n\nbuildCommandsSection(pkgCtx): string\n  Genera sección de comandos a partir de pkg.scripts:\n  ## Commands\n  ```bash\n  npm run dev    # Start development server\n  npm test       # Run tests\n  npm run build  # Build for production\n  ```\n  Si existe 'npm run lint', incluirlo. Si existe 'npm run type-check', incluirlo.\n\nbuildArchitectureSection(fsCtx, pkgCtx): string\n  Genera estructura de carpetas clave:\n  ## Architecture\n  - `src/` — Source code\n  - `packages/` — Monorepo packages (si aplica)\n  - `tests/` — Test files\n  Stack: {framework} + {orm} + {auth}\n\nbuildConventionsSection(pkgCtx): string\n  Genera convenciones detectadas:\n  ## Conventions\n  - Language: TypeScript (strict: {strict})\n  - Package manager: {packageManager}\n  - Testing: {testFramework}\n  - Linting: {linter}\n\nbuildComplianceSection(report): string\n  Si overall < 80:\n  ## ⚠ Compliance Signals\n  Overall score: {score}/100\n  Critical issues: {criticalIssues resumen}\n\nbuildImportantNotesSection(report, pkgCtx): string\n  Genera notas importantes:\n  ## Important Notes\n  - Context generated by @csantisgallegos/context. Update with: `context scan --project-root=.`\n  - {si hay PII detectado: 'This project handles personal data (PII). Review privacy compliance.'}\n  - {si hay secrets risk: 'Security signals detected. Review before committing.'}"
    },
    {
      "order": 3,
      "action": "Implementar toCLAUDEmd() en ContextEngine",
      "file": "packages/context-core/src/engine.ts",
      "detail": "async toCLAUDEmd(options: CLAUDEmdOptions = {}): Promise<string> {\n  const output = await this.collectContext();\n  const pkgCtx = output.contexts.find(c => c.type === 'package-json');\n  const gitCtx = output.contexts.find(c => c.type === 'git');\n  const fsCtx = output.contexts.find(c => c.type === 'filesystem');\n  const report = output.complianceReport;\n\n  const sections: string[] = [\n    buildOverviewSection(pkgCtx, gitCtx, options),\n    buildCommandsSection(pkgCtx, options),\n    buildArchitectureSection(fsCtx, pkgCtx, options),\n    buildConventionsSection(pkgCtx, options),\n  ];\n\n  if (report && options.complianceSummary !== false) {\n    sections.push(buildComplianceSection(report, options));\n  }\n\n  sections.push(buildImportantNotesSection(report, pkgCtx, options));\n\n  return sections.filter(Boolean).join('\\n\\n');\n}"
    },
    {
      "order": 4,
      "action": "Actualizar el CLI para soportar generación de CLAUDE.md",
      "file": "packages/context-cli/src/commands/scan.ts",
      "detail": "Agregar al comando scan la generación opcional de CLAUDE.md:\n\nconst claudeMd = await engine.toCLAUDEmd();\nconst claudeMdPath = path.join(options.projectRoot, 'CLAUDE.md');\n\n// Solo crear si no existe (no sobreescribir el que el usuario editó)\nif (!fs.existsSync(claudeMdPath)) {\n  fs.writeFileSync(claudeMdPath, claudeMd, 'utf-8');\n  console.log(`✓ CLAUDE.md created at: ${claudeMdPath}`);\n} else {\n  console.log(`ℹ CLAUDE.md already exists, skipping (use --force-claude to overwrite)`);\n}"
    },
    {
      "order": 5,
      "action": "Agregar flag --force-claude al CLI",
      "file": "packages/context-cli/src/cli.ts",
      "detail": "Agregar opción al comando scan:\n.option('--force-claude', 'Overwrite existing CLAUDE.md', false)\n\nPasar el flag a la función scan() para que decida si sobreescribir."
    },
    {
      "order": 6,
      "action": "Agregar tests para toCLAUDEmd()",
      "file": "packages/context-core/src/__tests__/engine.test.ts",
      "detail": "Tests:\n- toCLAUDEmd() retorna string con contenido Markdown\n- Contiene sección '## Commands' si hay scripts en package-json context\n- Contiene señales de compliance si hay complianceReport con issues\n- No contiene rutas absolutas del sistema\n- Con language='es' los títulos de sección están en español"
    },
    {
      "order": 7,
      "action": "Verificar build y tests",
      "command": "npm run build && npm test"
    }
  ],
  "acceptance_criteria": [
    "toAgentMd() existe en ContextEngine y retorna Promise<string>",
    "El AGENT.md generado tiene menos de 80 líneas",
    "Contiene links relativos a context/architecture.md, context/conventions.md y context/tasks/active/",
    "Contiene mención del comando para regenerar: 'context scan'",
    "El CLI sobreescribe AGENT.md en cada scan (siempre auto-generado)",
    "npm run build y npm test pasan sin errores"
  ],
  "agent_instructions": {
    "general": "El AGENT.md es un índice que cualquier agente de IA puede leer. Debe ser claro para un humano también. Priorizar brevedad sobre completitud: el detalle está en context/. Usar lenguaje directo, sin tecnicismos innecesarios.",
    "claude_code": "Implementa agent-md-builder.ts primero con funciones puras. Recuerda: AGENT.md apunta a context/, no duplica su contenido. Prueba con console.log antes de los tests formales.",
    "copilot": "Lee scan.ts y agent-md-builder.ts (si existe de p0-t03) como referencia. El builder de AGENT.md es el mismo que se usa en el refactor del scan.",
    "codex": "Provee ContextOutput, SignalData y los tipos de task como contexto. El AGENT.md es un template con datos reales, no generación de código."
  },
  "outputs": [
    "packages/context-core/src/engine.ts (modificado: toCLAUDEmd(), CLAUDEmdOptions)",
    "packages/context-core/src/claude-md-builder.ts (nuevo)",
    "packages/context-core/src/index.ts (modificado: exportar CLAUDEmdOptions)",
    "packages/context-cli/src/commands/scan.ts (modificado: generar CLAUDE.md)",
    "packages/context-cli/src/cli.ts (modificado: flag --force-claude)",
    "packages/context-core/src/__tests__/engine.test.ts (modificado: tests de toCLAUDEmd)"
  ]
}
